{
  "meta": {
    "spec_id": "shopkeeper-ravi-001",
    "name": "Ravi Kirana Store",
    "version": 1,
    "business_type": "shopkeeper",
    "created_date": "2026-01-30T00:00:00Z",
    "base_template": "shopkeeper-v1",
    "source": "template",
    "generation_confidence": 0.92,
    "template_family": "shopkeeper",
    "template_version": 1,
    "spec_version": 1,
    "policy_version": 1,
    "version_history": [
      {
        "version": 1,
        "date": "2026-01-30T00:00:00Z",
        "source": "generated",
        "changes": "Initial spec from shopkeeper template"
      }
    ],
    "customizations": []
  },

  "entities": [
    {
      "name": "Customer",
      "display_name": "Customer",
      "display_name_plural": "Customers",
      "icon": "👤",
      "fields": [
        {
          "name": "name",
          "display_name": "Name",
          "type": "text",
          "required": true,
          "searchable": true
        },
        {
          "name": "phone",
          "display_name": "Phone",
          "type": "phone",
          "required": false,
          "searchable": true
        },
        {
          "name": "address",
          "display_name": "Address",
          "type": "text",
          "required": false,
          "searchable": false
        }
      ],
      "relationships": [
        {
          "target": "Transaction",
          "type": "has_many",
          "foreign_key": "customer_id",
          "display_in_story": true
        },
        {
          "target": "Credit",
          "type": "has_many",
          "foreign_key": "customer_id",
          "display_in_story": true
        }
      ]
    },
    {
      "name": "Product",
      "display_name": "Product",
      "display_name_plural": "Products",
      "icon": "📦",
      "fields": [
        {
          "name": "name",
          "display_name": "Name",
          "type": "text",
          "required": true,
          "searchable": true
        },
        {
          "name": "price",
          "display_name": "Price",
          "type": "currency",
          "required": true,
          "prefix": "Rs.",
          "min": 0,
          "searchable": false
        },
        {
          "name": "category",
          "display_name": "Category",
          "type": "choice",
          "required": false,
          "options": ["grocery", "dairy", "snacks", "beverages", "household", "other"],
          "allow_custom": false,
          "searchable": true
        },
        {
          "name": "stock_quantity",
          "display_name": "Stock Quantity",
          "type": "number",
          "required": false,
          "min": 0,
          "searchable": false
        }
      ],
      "relationships": []
    },
    {
      "name": "Transaction",
      "display_name": "Transaction",
      "display_name_plural": "Transactions",
      "icon": "🧾",
      "fields": [
        {
          "name": "customer_id",
          "display_name": "Customer",
          "type": "text",
          "required": true,
          "searchable": false
        },
        {
          "name": "date",
          "display_name": "Date",
          "type": "date",
          "required": true,
          "searchable": false
        },
        {
          "name": "amount",
          "display_name": "Amount",
          "type": "currency",
          "required": true,
          "prefix": "Rs.",
          "min": 0,
          "searchable": false
        },
        {
          "name": "items_description",
          "display_name": "Items",
          "type": "text",
          "required": false,
          "searchable": true
        },
        {
          "name": "payment_method",
          "display_name": "Payment Method",
          "type": "choice",
          "required": false,
          "options": ["cash", "upi", "credit"],
          "allow_custom": false,
          "searchable": false
        }
      ],
      "relationships": [
        {
          "target": "Customer",
          "type": "belongs_to",
          "foreign_key": "customer_id",
          "display_in_story": false
        }
      ]
    },
    {
      "name": "Credit",
      "display_name": "Credit",
      "display_name_plural": "Credits",
      "icon": "📋",
      "fields": [
        {
          "name": "customer_id",
          "display_name": "Customer",
          "type": "text",
          "required": true,
          "searchable": false
        },
        {
          "name": "amount",
          "display_name": "Amount",
          "type": "currency",
          "required": true,
          "prefix": "Rs.",
          "min": 0,
          "searchable": false
        },
        {
          "name": "date",
          "display_name": "Date",
          "type": "date",
          "required": true,
          "searchable": false
        },
        {
          "name": "reason",
          "display_name": "Reason",
          "type": "text",
          "required": false,
          "searchable": true
        },
        {
          "name": "settled",
          "display_name": "Settled",
          "type": "toggle",
          "required": false,
          "default_value": false,
          "searchable": false
        }
      ],
      "relationships": [
        {
          "target": "Customer",
          "type": "belongs_to",
          "foreign_key": "customer_id",
          "display_in_story": false
        }
      ]
    }
  ],

  "anchor": {
    "type": "yesterday_summary",
    "entity": "Transaction",
    "greeting_template": "Good {time_of_day}, {user_name}",
    "date_label": "yesterday",
    "card_display": {
      "title": "{customer.name}",
      "subtitle": "Rs.{amount} - {payment_method}",
      "time_field": "date",
      "warning_field": "customer.outstanding_balance",
      "warning_template": "Rs.{customer.outstanding_balance} credit pending",
      "actions": ["edit", "delete"]
    },
    "empty_state": {
      "message": "No sales yesterday",
      "action": "Record a sale",
      "fallback_view": "calendar"
    },
    "summary": {
      "stats": [
        {
          "label": "Yesterday's sales",
          "query": "yesterday_sale_count"
        },
        {
          "label": "Total amount",
          "query": "yesterday_total_amount"
        }
      ]
    }
  },

  "story_events": {
    "Customer": {
      "events": [
        {
          "source": "Transaction",
          "relationship": "customer_id",
          "type": "purchase",
          "display": "{items_description} — Rs.{amount} ({payment_method})",
          "icon_color": "bloom"
        },
        {
          "source": "Transaction",
          "relationship": "customer_id",
          "type": "purchase_cash",
          "filter": {
            "field": "payment_method",
            "value": "cash"
          },
          "display": "{items_description} — Rs.{amount} (cash)",
          "icon_color": "bloom"
        },
        {
          "source": "Transaction",
          "relationship": "customer_id",
          "type": "purchase_upi",
          "filter": {
            "field": "payment_method",
            "value": "upi"
          },
          "display": "{items_description} — Rs.{amount} (upi)",
          "icon_color": "stream"
        },
        {
          "source": "Transaction",
          "relationship": "customer_id",
          "type": "purchase_credit",
          "filter": {
            "field": "payment_method",
            "value": "credit"
          },
          "display": "{items_description} — Rs.{amount} (credit)",
          "icon_color": "mist"
        },
        {
          "source": "Credit",
          "relationship": "customer_id",
          "type": "credit",
          "display": "Credit: Rs.{amount} — {reason}",
          "icon_color": "mist"
        }
      ],
      "stats_card": [
        {
          "label": "{phone}",
          "field": "phone"
        },
        {
          "label": "{total_purchases} purchases",
          "computed": "total_purchases"
        },
        {
          "label": "Rs.{outstanding_balance} pending",
          "computed": "outstanding_balance"
        }
      ],
      "coming_up": null,
      "origin": {
        "display": "{created_at} - {total_purchases} transactions"
      },
      "context": {
        "display": "Customer since {created_at}"
      }
    }
  },

  "add_flows": {
    "Customer": {
      "steps": [
        {
          "field": "name",
          "prompt": "Customer name?",
          "required": true,
          "keyboard": "default"
        },
        {
          "field": "phone",
          "prompt": "Phone number?",
          "required": false,
          "skip_text": "skip",
          "keyboard": "phone"
        },
        {
          "field": "address",
          "prompt": "Address?",
          "required": false,
          "skip_text": "skip",
          "keyboard": "default"
        }
      ],
      "after_add": {
        "action": "suggest",
        "text": "Record First Sale",
        "target": "Transaction",
        "pre_fill": {
          "customer_id": "{id}"
        }
      }
    },
    "Transaction": {
      "steps": [
        {
          "field": "customer_id",
          "prompt": "Which customer?",
          "required": true
        },
        {
          "field": "date",
          "prompt": "Date?",
          "required": true
        },
        {
          "field": "amount",
          "prompt": "Total amount?",
          "required": true,
          "keyboard": "number",
          "prefix": "Rs."
        },
        {
          "field": "items_description",
          "prompt": "What items?",
          "required": true,
          "keyboard": "default",
          "placeholder": "e.g. Rice 5kg, Dal 1kg, Oil"
        },
        {
          "field": "payment_method",
          "prompt": "Payment method?",
          "required": true
        }
      ],
      "after_add": {
        "action": "none"
      }
    },
    "Credit": {
      "steps": [
        {
          "field": "customer_id",